feed_title,feed_link,item_title,item_link,item_description,item_pub_date,topic
Python,https://devblogs.microsoft.com/python,Python in Visual Studio Code – March 2021 Release,https://devblogs.microsoft.com/python/python-in-visual-studio-code-march-2021-release/,"We are pleased to announce that the March 2021 release of the Python Extension for Visual Studio Code is now available. You can  download the Python extension  from the Marketplace, or install it directly from the extension gallery in Visual Studio Code.The post Python in Visual Studio Code – March 2021 Release appeared first on Python.",2021-03-16T20:45:13Z,#tech #engineering
Medium Engineering - Medium,https://medium.engineering?source=rss----2817475205d3---4,Counting your followers,https://medium.engineering/counting-your-followers-facbfafe45d9?source=rss----2817475205d3---4,NA,2020-11-24T21:28:01Z,#tech #engineering
Yelp Engineering and Product Blog,https://engineeringblog.yelp.com/,Minimizing read-write MySQL downtime,https://engineeringblog.yelp.com/2020/11/minimizing-read-write-mysql-downtime.html,"The relational database of choice at Yelp is MySQL and it powers much of the Yelp app and yelp.com. MySQL does not include a native high-availability solution for the replacement of a primary server, which is a single point of failure. This is a tradeoff of its dedication to ensuring consistency. Replacing a primary server is sometimes necessary due to planned or unplanned events, like an operating system upgrade, a database crash or hardware failure. This requires pausing data modifications to the database while the server is restarted or replaced and can mean minutes of downtime. Pausing data modifications means...",2020-11-09T00:00:00Z,#tech #engineering
Science & technology,https://www.economist.com/science-and-technology/,Two arthritis medicines prove effective for covid-19,https://www.economist.com/science-and-technology/2021/01/14/two-arthritis-medicines-prove-effective-for-covid-19,A pair of aces,2021-01-14T00:00:00Z,#tech #news
Startups – TechCrunch,https://techcrunch.com,TrueLayer raises $70M for its open banking platform,https://techcrunch.com/2021/04/08/truelayer-70m/,"TrueLayer, the London startup that offers a developer-friendly platform for companies, including other fintechs, to utilise open banking, is disclosing $70 million in new funding. The Series D round is led by new investor Addition. Existing investors, including Anthemis Group, Connect Ventures, Mouro Capital, Northzone and Temasek, also participated. New investors include Visionaries Club, Zack [&#8230;]",2021-04-08T07:00:13Z,#tech #news
Science & technology,https://www.economist.com/science-and-technology/,How to sterilise scalpels when no electricity is available,https://www.economist.com/science-and-technology/2020/11/26/how-to-sterilise-scalpels-when-no-electricity-is-available,Sunlight is the best disinfectant,2020-11-26T16:00:52Z,#tech #news
Science & technology,https://www.economist.com/science-and-technology/,"With millions vaccinated, rare side-effects of jabs are emerging",https://www.economist.com/science-and-technology/2021/04/07/with-millions-vaccinated-rare-side-effects-of-jabs-are-emerging,Sorting signal from noise,2021-04-07T00:00:00Z,#tech #news
